
*** Running vivado
    with args -log blk_mem_gen_0.vds -m64 -product Vivado -mode batch -messageDb vivado.pb -notrace -source blk_mem_gen_0.tcl


****** Vivado v2019.2 (64-bit)
  **** SW Build 2708876 on Wed Nov  6 21:40:23 MST 2019
  **** IP Build 2700528 on Thu Nov  7 00:09:20 MST 2019
    ** Copyright 1986-2019 Xilinx, Inc. All Rights Reserved.

source blk_mem_gen_0.tcl -notrace
create_project: Time (s): cpu = 00:00:03 ; elapsed = 00:00:07 . Memory (MB): peak = 423.801 ; gain = 133.250
INFO: [IP_Flow 19-234] Refreshing IP repositories
INFO: [IP_Flow 19-1700] Loaded user IP repository 'd:/wulian/DD/KWS-SOC-8bit/kws-ip/ip'.
INFO: [IP_Flow 19-2313] Loaded Vivado IP repository 'D:/Xilinx/Vivado/2019.2/data/ip'.
Command: synth_design -top blk_mem_gen_0 -part xc7a200tfbg484-1 -mode out_of_context
Starting synth_design
Attempting to get a license for feature 'Synthesis' and/or device 'xc7a200t'
INFO: [Common 17-349] Got license for feature 'Synthesis' and/or device 'xc7a200t'
INFO: [Device 21-403] Loading part xc7a200tfbg484-1
INFO: Launching helper process for spawning children vivado processes
INFO: Helper process launched with PID 9456 
---------------------------------------------------------------------------------
Starting RTL Elaboration : Time (s): cpu = 00:00:10 ; elapsed = 00:00:12 . Memory (MB): peak = 1012.387 ; gain = 235.566
---------------------------------------------------------------------------------
INFO: [Synth 8-638] synthesizing module 'blk_mem_gen_0' [d:/wulian/DD/KWS-SOC-8bit/KWS-SOC.srcs/sources_1/ip/blk_mem_gen_0/synth/blk_mem_gen_0.vhd:70]
	Parameter C_FAMILY bound to: artix7 - type: string 
	Parameter C_XDEVICEFAMILY bound to: artix7 - type: string 
	Parameter C_ELABORATION_DIR bound to: ./ - type: string 
	Parameter C_INTERFACE_TYPE bound to: 0 - type: integer 
	Parameter C_AXI_TYPE bound to: 1 - type: integer 
	Parameter C_AXI_SLAVE_TYPE bound to: 0 - type: integer 
	Parameter C_USE_BRAM_BLOCK bound to: 0 - type: integer 
	Parameter C_ENABLE_32BIT_ADDRESS bound to: 0 - type: integer 
	Parameter C_CTRL_ECC_ALGO bound to: NONE - type: string 
	Parameter C_HAS_AXI_ID bound to: 0 - type: integer 
	Parameter C_AXI_ID_WIDTH bound to: 4 - type: integer 
	Parameter C_MEM_TYPE bound to: 0 - type: integer 
	Parameter C_BYTE_SIZE bound to: 9 - type: integer 
	Parameter C_ALGORITHM bound to: 1 - type: integer 
	Parameter C_PRIM_TYPE bound to: 1 - type: integer 
	Parameter C_LOAD_INIT_FILE bound to: 1 - type: integer 
	Parameter C_INIT_FILE_NAME bound to: blk_mem_gen_0.mif - type: string 
	Parameter C_INIT_FILE bound to: blk_mem_gen_0.mem - type: string 
	Parameter C_USE_DEFAULT_DATA bound to: 1 - type: integer 
	Parameter C_DEFAULT_DATA bound to: 0 - type: string 
	Parameter C_HAS_RSTA bound to: 0 - type: integer 
	Parameter C_RST_PRIORITY_A bound to: CE - type: string 
	Parameter C_RSTRAM_A bound to: 0 - type: integer 
	Parameter C_INITA_VAL bound to: 0 - type: string 
	Parameter C_HAS_ENA bound to: 1 - type: integer 
	Parameter C_HAS_REGCEA bound to: 0 - type: integer 
	Parameter C_USE_BYTE_WEA bound to: 0 - type: integer 
	Parameter C_WEA_WIDTH bound to: 1 - type: integer 
	Parameter C_WRITE_MODE_A bound to: WRITE_FIRST - type: string 
	Parameter C_WRITE_WIDTH_A bound to: 32 - type: integer 
	Parameter C_READ_WIDTH_A bound to: 32 - type: integer 
	Parameter C_WRITE_DEPTH_A bound to: 9716 - type: integer 
	Parameter C_READ_DEPTH_A bound to: 9716 - type: integer 
	Parameter C_ADDRA_WIDTH bound to: 14 - type: integer 
	Parameter C_HAS_RSTB bound to: 0 - type: integer 
	Parameter C_RST_PRIORITY_B bound to: CE - type: string 
	Parameter C_RSTRAM_B bound to: 0 - type: integer 
	Parameter C_INITB_VAL bound to: 0 - type: string 
	Parameter C_HAS_ENB bound to: 0 - type: integer 
	Parameter C_HAS_REGCEB bound to: 0 - type: integer 
	Parameter C_USE_BYTE_WEB bound to: 0 - type: integer 
	Parameter C_WEB_WIDTH bound to: 1 - type: integer 
	Parameter C_WRITE_MODE_B bound to: WRITE_FIRST - type: string 
	Parameter C_WRITE_WIDTH_B bound to: 32 - type: integer 
	Parameter C_READ_WIDTH_B bound to: 32 - type: integer 
	Parameter C_WRITE_DEPTH_B bound to: 9716 - type: integer 
	Parameter C_READ_DEPTH_B bound to: 9716 - type: integer 
	Parameter C_ADDRB_WIDTH bound to: 14 - type: integer 
	Parameter C_HAS_MEM_OUTPUT_REGS_A bound to: 0 - type: integer 
	Parameter C_HAS_MEM_OUTPUT_REGS_B bound to: 0 - type: integer 
	Parameter C_HAS_MUX_OUTPUT_REGS_A bound to: 0 - type: integer 
	Parameter C_HAS_MUX_OUTPUT_REGS_B bound to: 0 - type: integer 
	Parameter C_MUX_PIPELINE_STAGES bound to: 0 - type: integer 
	Parameter C_HAS_SOFTECC_INPUT_REGS_A bound to: 0 - type: integer 
	Parameter C_HAS_SOFTECC_OUTPUT_REGS_B bound to: 0 - type: integer 
	Parameter C_USE_SOFTECC bound to: 0 - type: integer 
	Parameter C_USE_ECC bound to: 0 - type: integer 
	Parameter C_EN_ECC_PIPE bound to: 0 - type: integer 
	Parameter C_READ_LATENCY_A bound to: 1 - type: integer 
	Parameter C_READ_LATENCY_B bound to: 1 - type: integer 
	Parameter C_HAS_INJECTERR bound to: 0 - type: integer 
	Parameter C_SIM_COLLISION_CHECK bound to: ALL - type: string 
	Parameter C_COMMON_CLK bound to: 0 - type: integer 
	Parameter C_DISABLE_WARN_BHV_COLL bound to: 0 - type: integer 
	Parameter C_EN_SLEEP_PIN bound to: 0 - type: integer 
	Parameter C_USE_URAM bound to: 0 - type: integer 
	Parameter C_EN_RDADDRA_CHG bound to: 0 - type: integer 
	Parameter C_EN_RDADDRB_CHG bound to: 0 - type: integer 
	Parameter C_EN_DEEPSLEEP_PIN bound to: 0 - type: integer 
	Parameter C_EN_SHUTDOWN_PIN bound to: 0 - type: integer 
	Parameter C_EN_SAFETY_CKT bound to: 0 - type: integer 
	Parameter C_DISABLE_WARN_BHV_RANGE bound to: 0 - type: integer 
	Parameter C_COUNT_36K_BRAM bound to: 7 - type: string 
	Parameter C_COUNT_18K_BRAM bound to: 5 - type: string 
	Parameter C_EST_POWER_SUMMARY bound to: Estimated Power for IP     :     10.701475 mW - type: string 
INFO: [Synth 8-3491] module 'blk_mem_gen_v8_4_4' declared at 'd:/wulian/DD/KWS-SOC-8bit/KWS-SOC.srcs/sources_1/ip/blk_mem_gen_0/hdl/blk_mem_gen_v8_4_vhsyn_rfs.vhd:195321' bound to instance 'U0' of component 'blk_mem_gen_v8_4_4' [d:/wulian/DD/KWS-SOC-8bit/KWS-SOC.srcs/sources_1/ip/blk_mem_gen_0/synth/blk_mem_gen_0.vhd:236]
INFO: [Synth 8-256] done synthesizing module 'blk_mem_gen_0' (11#1) [d:/wulian/DD/KWS-SOC-8bit/KWS-SOC.srcs/sources_1/ip/blk_mem_gen_0/synth/blk_mem_gen_0.vhd:70]
WARNING: [Synth 8-3331] design blk_mem_output_block has unconnected port CLKB
WARNING: [Synth 8-3331] design blk_mem_output_block has unconnected port DOUTB_I[31]
WARNING: [Synth 8-3331] design blk_mem_output_block has unconnected port DOUTB_I[30]
WARNING: [Synth 8-3331] design blk_mem_output_block has unconnected port DOUTB_I[29]
WARNING: [Synth 8-3331] design blk_mem_output_block has unconnected port DOUTB_I[28]
WARNING: [Synth 8-3331] design blk_mem_output_block has unconnected port DOUTB_I[27]
WARNING: [Synth 8-3331] design blk_mem_output_block has unconnected port DOUTB_I[26]
WARNING: [Synth 8-3331] design blk_mem_output_block has unconnected port DOUTB_I[25]
WARNING: [Synth 8-3331] design blk_mem_output_block has unconnected port DOUTB_I[24]
WARNING: [Synth 8-3331] design blk_mem_output_block has unconnected port DOUTB_I[23]
WARNING: [Synth 8-3331] design blk_mem_output_block has unconnected port DOUTB_I[22]
WARNING: [Synth 8-3331] design blk_mem_output_block has unconnected port DOUTB_I[21]
WARNING: [Synth 8-3331] design blk_mem_output_block has unconnected port DOUTB_I[20]
WARNING: [Synth 8-3331] design blk_mem_output_block has unconnected port DOUTB_I[19]
WARNING: [Synth 8-3331] design blk_mem_output_block has unconnected port DOUTB_I[18]
WARNING: [Synth 8-3331] design blk_mem_output_block has unconnected port DOUTB_I[17]
WARNING: [Synth 8-3331] design blk_mem_output_block has unconnected port DOUTB_I[16]
WARNING: [Synth 8-3331] design blk_mem_output_block has unconnected port DOUTB_I[15]
WARNING: [Synth 8-3331] design blk_mem_output_block has unconnected port DOUTB_I[14]
WARNING: [Synth 8-3331] design blk_mem_output_block has unconnected port DOUTB_I[13]
WARNING: [Synth 8-3331] design blk_mem_output_block has unconnected port DOUTB_I[12]
WARNING: [Synth 8-3331] design blk_mem_output_block has unconnected port DOUTB_I[11]
WARNING: [Synth 8-3331] design blk_mem_output_block has unconnected port DOUTB_I[10]
WARNING: [Synth 8-3331] design blk_mem_output_block has unconnected port DOUTB_I[9]
WARNING: [Synth 8-3331] design blk_mem_output_block has unconnected port DOUTB_I[8]
WARNING: [Synth 8-3331] design blk_mem_output_block has unconnected port DOUTB_I[7]
WARNING: [Synth 8-3331] design blk_mem_output_block has unconnected port DOUTB_I[6]
WARNING: [Synth 8-3331] design blk_mem_output_block has unconnected port DOUTB_I[5]
WARNING: [Synth 8-3331] design blk_mem_output_block has unconnected port DOUTB_I[4]
WARNING: [Synth 8-3331] design blk_mem_output_block has unconnected port DOUTB_I[3]
WARNING: [Synth 8-3331] design blk_mem_output_block has unconnected port DOUTB_I[2]
WARNING: [Synth 8-3331] design blk_mem_output_block has unconnected port DOUTB_I[1]
WARNING: [Synth 8-3331] design blk_mem_output_block has unconnected port DOUTB_I[0]
WARNING: [Synth 8-3331] design blk_mem_output_block has unconnected port SBITERR_I
WARNING: [Synth 8-3331] design blk_mem_output_block has unconnected port DBITERR_I
WARNING: [Synth 8-3331] design blk_mem_output_block has unconnected port RDADDRECC_I[13]
WARNING: [Synth 8-3331] design blk_mem_output_block has unconnected port RDADDRECC_I[12]
WARNING: [Synth 8-3331] design blk_mem_output_block has unconnected port RDADDRECC_I[11]
WARNING: [Synth 8-3331] design blk_mem_output_block has unconnected port RDADDRECC_I[10]
WARNING: [Synth 8-3331] design blk_mem_output_block has unconnected port RDADDRECC_I[9]
WARNING: [Synth 8-3331] design blk_mem_output_block has unconnected port RDADDRECC_I[8]
WARNING: [Synth 8-3331] design blk_mem_output_block has unconnected port RDADDRECC_I[7]
WARNING: [Synth 8-3331] design blk_mem_output_block has unconnected port RDADDRECC_I[6]
WARNING: [Synth 8-3331] design blk_mem_output_block has unconnected port RDADDRECC_I[5]
WARNING: [Synth 8-3331] design blk_mem_output_block has unconnected port RDADDRECC_I[4]
WARNING: [Synth 8-3331] design blk_mem_output_block has unconnected port RDADDRECC_I[3]
WARNING: [Synth 8-3331] design blk_mem_output_block has unconnected port RDADDRECC_I[2]
WARNING: [Synth 8-3331] design blk_mem_output_block has unconnected port RDADDRECC_I[1]
WARNING: [Synth 8-3331] design blk_mem_output_block has unconnected port RDADDRECC_I[0]
WARNING: [Synth 8-3331] design blk_mem_gen_prim_wrapper_init__parameterized10 has unconnected port SSRA
WARNING: [Synth 8-3331] design blk_mem_gen_prim_wrapper_init__parameterized10 has unconnected port CLKB
WARNING: [Synth 8-3331] design blk_mem_gen_prim_wrapper_init__parameterized10 has unconnected port SSRB
WARNING: [Synth 8-3331] design blk_mem_gen_prim_wrapper_init__parameterized10 has unconnected port ENB
WARNING: [Synth 8-3331] design blk_mem_gen_prim_wrapper_init__parameterized10 has unconnected port REGCEB
WARNING: [Synth 8-3331] design blk_mem_gen_prim_wrapper_init__parameterized10 has unconnected port WEB[0]
WARNING: [Synth 8-3331] design blk_mem_gen_prim_wrapper_init__parameterized10 has unconnected port ADDRB[11]
WARNING: [Synth 8-3331] design blk_mem_gen_prim_wrapper_init__parameterized10 has unconnected port ADDRB[10]
WARNING: [Synth 8-3331] design blk_mem_gen_prim_wrapper_init__parameterized10 has unconnected port ADDRB[9]
WARNING: [Synth 8-3331] design blk_mem_gen_prim_wrapper_init__parameterized10 has unconnected port ADDRB[8]
WARNING: [Synth 8-3331] design blk_mem_gen_prim_wrapper_init__parameterized10 has unconnected port ADDRB[7]
WARNING: [Synth 8-3331] design blk_mem_gen_prim_wrapper_init__parameterized10 has unconnected port ADDRB[6]
WARNING: [Synth 8-3331] design blk_mem_gen_prim_wrapper_init__parameterized10 has unconnected port ADDRB[5]
WARNING: [Synth 8-3331] design blk_mem_gen_prim_wrapper_init__parameterized10 has unconnected port ADDRB[4]
WARNING: [Synth 8-3331] design blk_mem_gen_prim_wrapper_init__parameterized10 has unconnected port ADDRB[3]
WARNING: [Synth 8-3331] design blk_mem_gen_prim_wrapper_init__parameterized10 has unconnected port ADDRB[2]
WARNING: [Synth 8-3331] design blk_mem_gen_prim_wrapper_init__parameterized10 has unconnected port ADDRB[1]
WARNING: [Synth 8-3331] design blk_mem_gen_prim_wrapper_init__parameterized10 has unconnected port ADDRB[0]
WARNING: [Synth 8-3331] design blk_mem_gen_prim_wrapper_init__parameterized10 has unconnected port DINB[8]
WARNING: [Synth 8-3331] design blk_mem_gen_prim_wrapper_init__parameterized10 has unconnected port DINB[7]
WARNING: [Synth 8-3331] design blk_mem_gen_prim_wrapper_init__parameterized10 has unconnected port DINB[6]
WARNING: [Synth 8-3331] design blk_mem_gen_prim_wrapper_init__parameterized10 has unconnected port DINB[5]
WARNING: [Synth 8-3331] design blk_mem_gen_prim_wrapper_init__parameterized10 has unconnected port DINB[4]
WARNING: [Synth 8-3331] design blk_mem_gen_prim_wrapper_init__parameterized10 has unconnected port DINB[3]
WARNING: [Synth 8-3331] design blk_mem_gen_prim_wrapper_init__parameterized10 has unconnected port DINB[2]
WARNING: [Synth 8-3331] design blk_mem_gen_prim_wrapper_init__parameterized10 has unconnected port DINB[1]
WARNING: [Synth 8-3331] design blk_mem_gen_prim_wrapper_init__parameterized10 has unconnected port DINB[0]
WARNING: [Synth 8-3331] design blk_mem_gen_prim_wrapper_init__parameterized10 has unconnected port SLEEP
WARNING: [Synth 8-3331] design blk_mem_gen_prim_wrapper_init__parameterized10 has unconnected port INJECTSBITERR
WARNING: [Synth 8-3331] design blk_mem_gen_prim_wrapper_init__parameterized10 has unconnected port INJECTDBITERR
WARNING: [Synth 8-3331] design blk_mem_gen_prim_wrapper_init__parameterized10 has unconnected port ECCPIPECE
WARNING: [Synth 8-3331] design blk_mem_gen_prim_wrapper_init__parameterized10 has unconnected port ram_rstram_b
WARNING: [Synth 8-3331] design blk_mem_gen_prim_wrapper_init__parameterized10 has unconnected port ram_rstreg_b
WARNING: [Synth 8-3331] design blk_mem_gen_prim_wrapper_init__parameterized9 has unconnected port SSRA
WARNING: [Synth 8-3331] design blk_mem_gen_prim_wrapper_init__parameterized9 has unconnected port CLKB
WARNING: [Synth 8-3331] design blk_mem_gen_prim_wrapper_init__parameterized9 has unconnected port SSRB
WARNING: [Synth 8-3331] design blk_mem_gen_prim_wrapper_init__parameterized9 has unconnected port ENB
WARNING: [Synth 8-3331] design blk_mem_gen_prim_wrapper_init__parameterized9 has unconnected port REGCEB
WARNING: [Synth 8-3331] design blk_mem_gen_prim_wrapper_init__parameterized9 has unconnected port WEB[0]
WARNING: [Synth 8-3331] design blk_mem_gen_prim_wrapper_init__parameterized9 has unconnected port ADDRB[11]
WARNING: [Synth 8-3331] design blk_mem_gen_prim_wrapper_init__parameterized9 has unconnected port ADDRB[10]
WARNING: [Synth 8-3331] design blk_mem_gen_prim_wrapper_init__parameterized9 has unconnected port ADDRB[9]
WARNING: [Synth 8-3331] design blk_mem_gen_prim_wrapper_init__parameterized9 has unconnected port ADDRB[8]
WARNING: [Synth 8-3331] design blk_mem_gen_prim_wrapper_init__parameterized9 has unconnected port ADDRB[7]
WARNING: [Synth 8-3331] design blk_mem_gen_prim_wrapper_init__parameterized9 has unconnected port ADDRB[6]
WARNING: [Synth 8-3331] design blk_mem_gen_prim_wrapper_init__parameterized9 has unconnected port ADDRB[5]
WARNING: [Synth 8-3331] design blk_mem_gen_prim_wrapper_init__parameterized9 has unconnected port ADDRB[4]
WARNING: [Synth 8-3331] design blk_mem_gen_prim_wrapper_init__parameterized9 has unconnected port ADDRB[3]
WARNING: [Synth 8-3331] design blk_mem_gen_prim_wrapper_init__parameterized9 has unconnected port ADDRB[2]
WARNING: [Synth 8-3331] design blk_mem_gen_prim_wrapper_init__parameterized9 has unconnected port ADDRB[1]
WARNING: [Synth 8-3331] design blk_mem_gen_prim_wrapper_init__parameterized9 has unconnected port ADDRB[0]
INFO: [Common 17-14] Message 'Synth 8-3331' appears 100 times and further instances of the messages will be disabled. Use the Tcl command set_msg_config to change the current settings.
---------------------------------------------------------------------------------
Finished RTL Elaboration : Time (s): cpu = 00:00:56 ; elapsed = 00:00:59 . Memory (MB): peak = 1350.547 ; gain = 573.727
---------------------------------------------------------------------------------

Report Check Netlist: 
+------+------------------+-------+---------+-------+------------------+
|      |Item              |Errors |Warnings |Status |Description       |
+------+------------------+-------+---------+-------+------------------+
|1     |multi_driven_nets |      0|        0|Passed |Multi driven nets |
+------+------------------+-------+---------+-------+------------------+
---------------------------------------------------------------------------------
Start Handling Custom Attributes
---------------------------------------------------------------------------------
---------------------------------------------------------------------------------
Finished Handling Custom Attributes : Time (s): cpu = 00:00:56 ; elapsed = 00:01:00 . Memory (MB): peak = 1350.547 ; gain = 573.727
---------------------------------------------------------------------------------
---------------------------------------------------------------------------------
Finished RTL Optimization Phase 1 : Time (s): cpu = 00:00:56 ; elapsed = 00:01:00 . Memory (MB): peak = 1350.547 ; gain = 573.727
---------------------------------------------------------------------------------
Netlist sorting complete. Time (s): cpu = 00:00:00 ; elapsed = 00:00:00.044 . Memory (MB): peak = 1350.547 ; gain = 0.000
INFO: [Netlist 29-17] Analyzing 12 Unisim elements for replacement
INFO: [Netlist 29-28] Unisim Transformation completed in 0 CPU seconds
INFO: [Project 1-570] Preparing netlist for logic optimization

Processing XDC Constraints
Initializing timing engine
Parsing XDC File [d:/wulian/DD/KWS-SOC-8bit/KWS-SOC.srcs/sources_1/ip/blk_mem_gen_0/blk_mem_gen_0_ooc.xdc] for cell 'U0'
Finished Parsing XDC File [d:/wulian/DD/KWS-SOC-8bit/KWS-SOC.srcs/sources_1/ip/blk_mem_gen_0/blk_mem_gen_0_ooc.xdc] for cell 'U0'
Parsing XDC File [D:/wulian/DD/KWS-SOC-8bit/KWS-SOC.runs/blk_mem_gen_0_synth_1/dont_touch.xdc]
Finished Parsing XDC File [D:/wulian/DD/KWS-SOC-8bit/KWS-SOC.runs/blk_mem_gen_0_synth_1/dont_touch.xdc]
Completed Processing XDC Constraints

Netlist sorting complete. Time (s): cpu = 00:00:00 ; elapsed = 00:00:00 . Memory (MB): peak = 1350.547 ; gain = 0.000
INFO: [Project 1-111] Unisim Transformation Summary:
No Unisim elements were transformed.

Constraint Validation Runtime : Time (s): cpu = 00:00:00 ; elapsed = 00:00:00.068 . Memory (MB): peak = 1350.547 ; gain = 0.000
---------------------------------------------------------------------------------
Finished Constraint Validation : Time (s): cpu = 00:01:06 ; elapsed = 00:01:10 . Memory (MB): peak = 1350.547 ; gain = 573.727
---------------------------------------------------------------------------------
---------------------------------------------------------------------------------
Start Loading Part and Timing Information
---------------------------------------------------------------------------------
Loading part: xc7a200tfbg484-1
---------------------------------------------------------------------------------
Finished Loading Part and Timing Information : Time (s): cpu = 00:01:06 ; elapsed = 00:01:10 . Memory (MB): peak = 1350.547 ; gain = 573.727
---------------------------------------------------------------------------------
---------------------------------------------------------------------------------
Start Applying 'set_property' XDC Constraints
---------------------------------------------------------------------------------
Applied set_property DONT_TOUCH = true for U0. (constraint file  D:/wulian/DD/KWS-SOC-8bit/KWS-SOC.runs/blk_mem_gen_0_synth_1/dont_touch.xdc, line 9).
---------------------------------------------------------------------------------
Finished applying 'set_property' XDC Constraints : Time (s): cpu = 00:01:06 ; elapsed = 00:01:10 . Memory (MB): peak = 1350.547 ; gain = 573.727
---------------------------------------------------------------------------------
---------------------------------------------------------------------------------
Finished RTL Optimization Phase 2 : Time (s): cpu = 00:01:07 ; elapsed = 00:01:11 . Memory (MB): peak = 1350.547 ; gain = 573.727
---------------------------------------------------------------------------------

Report RTL Partitions: 
+-+--------------+------------+----------+
| |RTL Partition |Replication |Instances |
+-+--------------+------------+----------+
+-+--------------+------------+----------+
---------------------------------------------------------------------------------
Start RTL Component Statistics 
---------------------------------------------------------------------------------
Detailed RTL Component Info : 
+---Registers : 
	                3 Bit    Registers := 2     
+---Muxes : 
	   2 Input      1 Bit        Muxes := 16    
---------------------------------------------------------------------------------
Finished RTL Component Statistics 
---------------------------------------------------------------------------------
---------------------------------------------------------------------------------
Start RTL Hierarchical Component Statistics 
---------------------------------------------------------------------------------
Hierarchical RTL Component report 
Module bindec 
Detailed RTL Component Info : 
+---Muxes : 
	   2 Input      1 Bit        Muxes := 8     
Module blk_mem_gen_mux 
Detailed RTL Component Info : 
+---Registers : 
	                3 Bit    Registers := 1     
Module blk_mem_gen_mux__parameterized0 
Detailed RTL Component Info : 
+---Registers : 
	                3 Bit    Registers := 1     
---------------------------------------------------------------------------------
Finished RTL Hierarchical Component Statistics
---------------------------------------------------------------------------------
---------------------------------------------------------------------------------
Start Part Resource Summary
---------------------------------------------------------------------------------
Part Resources:
DSPs: 740 (col length:100)
BRAMs: 730 (col length: RAMB18 100 RAMB36 50)
---------------------------------------------------------------------------------
Finished Part Resource Summary
---------------------------------------------------------------------------------
---------------------------------------------------------------------------------
Start Cross Boundary and Area Optimization
---------------------------------------------------------------------------------
Warning: Parallel synthesis criteria is not met 
---------------------------------------------------------------------------------
Finished Cross Boundary and Area Optimization : Time (s): cpu = 00:01:09 ; elapsed = 00:01:13 . Memory (MB): peak = 1350.547 ; gain = 573.727
---------------------------------------------------------------------------------

Report RTL Partitions: 
+-+--------------+------------+----------+
| |RTL Partition |Replication |Instances |
+-+--------------+------------+----------+
+-+--------------+------------+----------+
---------------------------------------------------------------------------------
Start Applying XDC Timing Constraints
---------------------------------------------------------------------------------
---------------------------------------------------------------------------------
Finished Applying XDC Timing Constraints : Time (s): cpu = 00:01:18 ; elapsed = 00:01:22 . Memory (MB): peak = 1350.547 ; gain = 573.727
---------------------------------------------------------------------------------
---------------------------------------------------------------------------------
Start Timing Optimization
---------------------------------------------------------------------------------
---------------------------------------------------------------------------------
Finished Timing Optimization : Time (s): cpu = 00:01:18 ; elapsed = 00:01:22 . Memory (MB): peak = 1350.547 ; gain = 573.727
---------------------------------------------------------------------------------

Report RTL Partitions: 
+-+--------------+------------+----------+
| |RTL Partition |Replication |Instances |
+-+--------------+------------+----------+
+-+--------------+------------+----------+
---------------------------------------------------------------------------------
Start Technology Mapping
---------------------------------------------------------------------------------
---------------------------------------------------------------------------------
Finished Technology Mapping : Time (s): cpu = 00:01:18 ; elapsed = 00:01:22 . Memory (MB): peak = 1350.547 ; gain = 573.727
---------------------------------------------------------------------------------

Report RTL Partitions: 
+-+--------------+------------+----------+
| |RTL Partition |Replication |Instances |
+-+--------------+------------+----------+
+-+--------------+------------+----------+
---------------------------------------------------------------------------------
Start IO Insertion
---------------------------------------------------------------------------------
---------------------------------------------------------------------------------
Start Flattening Before IO Insertion
---------------------------------------------------------------------------------
---------------------------------------------------------------------------------
Finished Flattening Before IO Insertion
---------------------------------------------------------------------------------
---------------------------------------------------------------------------------
Start Final Netlist Cleanup
---------------------------------------------------------------------------------
---------------------------------------------------------------------------------
Finished Final Netlist Cleanup
---------------------------------------------------------------------------------
---------------------------------------------------------------------------------
Finished IO Insertion : Time (s): cpu = 00:01:23 ; elapsed = 00:01:27 . Memory (MB): peak = 1350.547 ; gain = 573.727
---------------------------------------------------------------------------------
---------------------------------------------------------------------------------
Start Renaming Generated Instances
---------------------------------------------------------------------------------
---------------------------------------------------------------------------------
Finished Renaming Generated Instances : Time (s): cpu = 00:01:23 ; elapsed = 00:01:27 . Memory (MB): peak = 1350.547 ; gain = 573.727
---------------------------------------------------------------------------------

Report RTL Partitions: 
+-+--------------+------------+----------+
| |RTL Partition |Replication |Instances |
+-+--------------+------------+----------+
+-+--------------+------------+----------+

Report Check Netlist: 
+------+------------------+-------+---------+-------+------------------+
|      |Item              |Errors |Warnings |Status |Description       |
+------+------------------+-------+---------+-------+------------------+
|1     |multi_driven_nets |      0|        0|Passed |Multi driven nets |
+------+------------------+-------+---------+-------+------------------+
---------------------------------------------------------------------------------
Start Rebuilding User Hierarchy
---------------------------------------------------------------------------------
---------------------------------------------------------------------------------
Finished Rebuilding User Hierarchy : Time (s): cpu = 00:01:23 ; elapsed = 00:01:27 . Memory (MB): peak = 1350.547 ; gain = 573.727
---------------------------------------------------------------------------------
---------------------------------------------------------------------------------
Start Renaming Generated Ports
---------------------------------------------------------------------------------
---------------------------------------------------------------------------------
Finished Renaming Generated Ports : Time (s): cpu = 00:01:23 ; elapsed = 00:01:27 . Memory (MB): peak = 1350.547 ; gain = 573.727
---------------------------------------------------------------------------------
---------------------------------------------------------------------------------
Start Handling Custom Attributes
---------------------------------------------------------------------------------
---------------------------------------------------------------------------------
Finished Handling Custom Attributes : Time (s): cpu = 00:01:23 ; elapsed = 00:01:27 . Memory (MB): peak = 1350.547 ; gain = 573.727
---------------------------------------------------------------------------------
---------------------------------------------------------------------------------
Start Renaming Generated Nets
---------------------------------------------------------------------------------
---------------------------------------------------------------------------------
Finished Renaming Generated Nets : Time (s): cpu = 00:01:23 ; elapsed = 00:01:27 . Memory (MB): peak = 1350.547 ; gain = 573.727
---------------------------------------------------------------------------------
---------------------------------------------------------------------------------
Start Writing Synthesis Report
---------------------------------------------------------------------------------

Report BlackBoxes: 
+-+--------------+----------+
| |BlackBox name |Instances |
+-+--------------+----------+
+-+--------------+----------+

Report Cell Usage: 
+------+-----------+------+
|      |Cell       |Count |
+------+-----------+------+
|1     |LUT2       |     1|
|2     |LUT3       |     6|
|3     |LUT4       |     5|
|4     |LUT6       |    27|
|5     |RAMB18E1   |     1|
|6     |RAMB18E1_1 |     1|
|7     |RAMB18E1_2 |     1|
|8     |RAMB18E1_3 |     1|
|9     |RAMB18E1_4 |     1|
|10    |RAMB36E1   |     1|
|11    |RAMB36E1_1 |     1|
|12    |RAMB36E1_2 |     1|
|13    |RAMB36E1_3 |     1|
|14    |RAMB36E1_4 |     1|
|15    |RAMB36E1_5 |     1|
|16    |RAMB36E1_6 |     1|
|17    |FDRE       |     3|
+------+-----------+------+

Report Instance Areas: 
+------+---------------------------------------------+-----------------------------------------------+------+
|      |Instance                                     |Module                                         |Cells |
+------+---------------------------------------------+-----------------------------------------------+------+
|1     |top                                          |                                               |    54|
|2     |  U0                                         |blk_mem_gen_v8_4_4                             |    54|
|3     |    inst_blk_mem_gen                         |blk_mem_gen_v8_4_4_synth                       |    54|
|4     |      \gnbram.gnativebmg.native_blk_mem_gen  |blk_mem_gen_top                                |    54|
|5     |        \valid.cstr                          |blk_mem_gen_generic_cstr                       |    54|
|6     |          \bindec_a.bindec_inst_a            |bindec                                         |     1|
|7     |          \has_mux_a.A                       |blk_mem_gen_mux                                |    37|
|8     |          \ramloop[0].ram.r                  |blk_mem_gen_prim_width                         |     1|
|9     |            \prim_init.ram                   |blk_mem_gen_prim_wrapper_init                  |     1|
|10    |          \ramloop[10].ram.r                 |blk_mem_gen_prim_width__parameterized9         |     1|
|11    |            \prim_init.ram                   |blk_mem_gen_prim_wrapper_init__parameterized9  |     1|
|12    |          \ramloop[11].ram.r                 |blk_mem_gen_prim_width__parameterized10        |     2|
|13    |            \prim_init.ram                   |blk_mem_gen_prim_wrapper_init__parameterized10 |     2|
|14    |          \ramloop[1].ram.r                  |blk_mem_gen_prim_width__parameterized0         |     2|
|15    |            \prim_init.ram                   |blk_mem_gen_prim_wrapper_init__parameterized0  |     2|
|16    |          \ramloop[2].ram.r                  |blk_mem_gen_prim_width__parameterized1         |     2|
|17    |            \prim_init.ram                   |blk_mem_gen_prim_wrapper_init__parameterized1  |     2|
|18    |          \ramloop[3].ram.r                  |blk_mem_gen_prim_width__parameterized2         |     1|
|19    |            \prim_init.ram                   |blk_mem_gen_prim_wrapper_init__parameterized2  |     1|
|20    |          \ramloop[4].ram.r                  |blk_mem_gen_prim_width__parameterized3         |     1|
|21    |            \prim_init.ram                   |blk_mem_gen_prim_wrapper_init__parameterized3  |     1|
|22    |          \ramloop[5].ram.r                  |blk_mem_gen_prim_width__parameterized4         |     1|
|23    |            \prim_init.ram                   |blk_mem_gen_prim_wrapper_init__parameterized4  |     1|
|24    |          \ramloop[6].ram.r                  |blk_mem_gen_prim_width__parameterized5         |     1|
|25    |            \prim_init.ram                   |blk_mem_gen_prim_wrapper_init__parameterized5  |     1|
|26    |          \ramloop[7].ram.r                  |blk_mem_gen_prim_width__parameterized6         |     2|
|27    |            \prim_init.ram                   |blk_mem_gen_prim_wrapper_init__parameterized6  |     2|
|28    |          \ramloop[8].ram.r                  |blk_mem_gen_prim_width__parameterized7         |     1|
|29    |            \prim_init.ram                   |blk_mem_gen_prim_wrapper_init__parameterized7  |     1|
|30    |          \ramloop[9].ram.r                  |blk_mem_gen_prim_width__parameterized8         |     1|
|31    |            \prim_init.ram                   |blk_mem_gen_prim_wrapper_init__parameterized8  |     1|
+------+---------------------------------------------+-----------------------------------------------+------+
---------------------------------------------------------------------------------
Finished Writing Synthesis Report : Time (s): cpu = 00:01:23 ; elapsed = 00:01:27 . Memory (MB): peak = 1350.547 ; gain = 573.727
---------------------------------------------------------------------------------
Synthesis finished with 0 errors, 0 critical warnings and 199 warnings.
Synthesis Optimization Runtime : Time (s): cpu = 00:00:22 ; elapsed = 00:01:23 . Memory (MB): peak = 1350.547 ; gain = 573.727
Synthesis Optimization Complete : Time (s): cpu = 00:01:23 ; elapsed = 00:01:28 . Memory (MB): peak = 1350.547 ; gain = 573.727
INFO: [Project 1-571] Translating synthesized netlist
Netlist sorting complete. Time (s): cpu = 00:00:00 ; elapsed = 00:00:00.010 . Memory (MB): peak = 1350.547 ; gain = 0.000
INFO: [Netlist 29-17] Analyzing 12 Unisim elements for replacement
INFO: [Netlist 29-28] Unisim Transformation completed in 0 CPU seconds
INFO: [Project 1-570] Preparing netlist for logic optimization
INFO: [Opt 31-138] Pushed 0 inverter(s) to 0 load pin(s).
Netlist sorting complete. Time (s): cpu = 00:00:00 ; elapsed = 00:00:00 . Memory (MB): peak = 1350.547 ; gain = 0.000
INFO: [Project 1-111] Unisim Transformation Summary:
No Unisim elements were transformed.

INFO: [Common 17-83] Releasing license: Synthesis
20 Infos, 100 Warnings, 0 Critical Warnings and 0 Errors encountered.
synth_design completed successfully
synth_design: Time (s): cpu = 00:01:30 ; elapsed = 00:01:44 . Memory (MB): peak = 1350.547 ; gain = 894.691
Netlist sorting complete. Time (s): cpu = 00:00:00 ; elapsed = 00:00:00 . Memory (MB): peak = 1350.547 ; gain = 0.000
WARNING: [Constraints 18-5210] No constraints selected for write.
Resolution: This message can indicate that there are no constraints for the design, or it can indicate that the used_in flags are set such that the constraints are ignored. This later case is used when running synth_design to not write synthesis constraints to the resulting checkpoint. Instead, project constraints are read when the synthesized design is opened.
INFO: [Common 17-1381] The checkpoint 'D:/wulian/DD/KWS-SOC-8bit/KWS-SOC.runs/blk_mem_gen_0_synth_1/blk_mem_gen_0.dcp' has been generated.
WARNING: [Common 17-576] 'use_project_ipc' is deprecated. This option is deprecated and no longer used.
INFO: [Coretcl 2-1648] Added synthesis output to IP cache for IP blk_mem_gen_0, cache-ID = 5692f2cdcd402b56
INFO: [Coretcl 2-1174] Renamed 30 cell refs.
Netlist sorting complete. Time (s): cpu = 00:00:00 ; elapsed = 00:00:00 . Memory (MB): peak = 1350.547 ; gain = 0.000
WARNING: [Constraints 18-5210] No constraints selected for write.
Resolution: This message can indicate that there are no constraints for the design, or it can indicate that the used_in flags are set such that the constraints are ignored. This later case is used when running synth_design to not write synthesis constraints to the resulting checkpoint. Instead, project constraints are read when the synthesized design is opened.
INFO: [Common 17-1381] The checkpoint 'D:/wulian/DD/KWS-SOC-8bit/KWS-SOC.runs/blk_mem_gen_0_synth_1/blk_mem_gen_0.dcp' has been generated.
INFO: [runtcl-4] Executing : report_utilization -file blk_mem_gen_0_utilization_synth.rpt -pb blk_mem_gen_0_utilization_synth.pb
INFO: [Common 17-206] Exiting Vivado at Mon Aug 17 14:25:00 2020...
